kod towaru;nazwa;ean;stan;dostepnosc
003064-001992;MX9023-1L PICO LAMPA SUFITOWA CZARNA;2011004554664;0;50 week 52/2021 | -
003064-001993;MD9023-1S PICO LAMPA WISZĄCA CZARNA;2011004554923;0;200 week 52/2021 | -
003064-001994;MD9023-3B PICO LAMPA WISZĄCA CZARNA;2011004554954;0;150 week 52/2021 | -
003064-001995;MD1629-1 MONIC LAMPA WISZĄCA CHROME;2011005483253;258;-
003064-001996;MD1629-1 MONIC LAMPA WISZĄCA MIEDŹ/COPPER;2011005483260;101;-
003064-001997;MD1629-3A MONIC LAMPA WISZĄCA CHROME;2011005483291;70;39 week 52/2021 | -
003064-001998;MD1629-3B MONIC LAMPA WISZĄCA MIEDŹ/COPPER;2011005483390;112;-
003064-001999;MD1629-5B MONIC LAMPA WISZĄCA CHROME;2011005483413;90;-
003064-002000;P0076-05K-F4GQ VISTA LAMPA WISZĄCA ZŁOTA;2011004907200;148;-
003064-002001;C0076-06X-F4K9 RAIN LAMPA SUFITOWA;2011004915175;81;40 week 52/2021 | 60 week 50/2021| -
003064-002002;P0076-05L-F4K9 RAIN LAMPA WISZĄCA;2011004915229;101;50 week 51/2021 -
003064-002003;P0076-06X-F4K9 RAIN LAMPA WISZĄCA;2011004915236;91;30 week 48/2021 | 20 week 52/2021 | -
003064-002004;92698 SANDY WL SQUARE KINKIET CZARNY/BLACK;2011005826487;438;800 week 52/2021 |
003064-003315;MX1104-2 TANGO LAMPA SUFITOWA CZARNA;2011002707239;3;150 week 52/2021 | -
003064-003316;P0369-01D-F4GW PIOLI LAMPA WISZĄCA;2011005469592;0;-
003064-003318;P0369-01A-F4GR PIOLI LAMPA WISZĄCA;2011005469547;0;50 week 50/2021| -
003064-003320;TS-110314F-BK LORITA LAMPA PODŁOGOWA;2011004003384;0;200 week 52/2021 | 190 in production | -
003064-003489;P0461-01A-F4F4 LOYA LAMPA WISZĄCA CHROME;2011005986419;395;-
003064-003490;P0461-01A-F7F7 LOYA LAMPA WISZĄCA ZŁOTA/GOLD;2011005986426;195;-
003064-003491;P0461-01A-L7L7 LOYA LAMPA WISZĄCA MIEDŹ/COPPER;2011005986433;103;100 January 2022 | 200 in production | -
003064-003492;P0461-01A-S8S8 LOYA LAMPA WISZĄCA BIAŁA/WHITE;2011005986440;0;200 January 2022 | -
003064-003493;P0461-01A-L8L8 LOYA LAMPA WISZĄCA CZARNA/BLACK;2011005986457;1342;-
003064-003494;P0461-09C-B5SC LOYA LAMPA WISZĄCA CHROME+GOLD+COPPER;2011005986464;44;-
003064-003495;P0461-09C-B5SB LOYA LAMPA WISZĄCA GOLD+MATT WHITE;2011005986471;60;-
003064-003496;P0461-11A-B5SC LOYA LAMPA WISZĄCA CHROME+GOLD+COPPER;2011005986488;82;-
003064-003499;P0454-12C-SDGF RIANO LAMPA WISZĄCA GOLD+BLACK+CLEAR+OPAL;2011005986501;197;-
003064-003500;W0454-02A-SDAA RIANO KINKIET GOLD+BLACK+OPAL;2011005986518;18;-
003064-003505;W0454-02D-SDAC RIANO KINKIET GOLD+BLACK+CLEAR;2011005986532;100;-
003064-003520;C0076-05L-F4L9 RAIN LAMPA SUFITOWA ZŁOTA/GOLD;2011005986686;42;-
003064-003522;P0076-05L-F7L9 RAIN LAMPA WISZĄCA ZŁOTA/GOLD;2011005986709;75;-
003064-003526;W0076-01A-B5L9 RAIN KINKIET ZŁOTY/GOLD;2011005986747;11;-
003064-003540;P0454-08D-SDAC RIANO LAMPA WISZĄCA GOLD+BLACK+CLEAR;2011005986525;126;-
003064-003547;P0454-08C-SDGF RIANO LAMPA WISZĄCA GOLD+BLACK+CLEAR+OPAL;2011005986495;208;-
003064-003550;MD1629-5B MONIC LAMPA WISZĄCA MIEDŹ/COPPER;2011005483420;72;-
003064-003551;MD1629-3A MONIC LAMPA WISZĄCA MIEDŹ/COPPER;2011005483307;82;-
003064-003552;MD1629-3B MONIC LAMPA WISZĄCA CHROME;2011005483321;83;-
003064-005284;MD1712-1A-SILVER WIRE LAMPA WISZĄCA SREBRNA/SILVER;2011006019383;0;-
003064-005285;MD1712-1A-BLACK WIRE LAMPA WISZĄCA CZARNA/BLACK;2011006019390;0;-
003064-005286;MD1712-1B-SILVER WIRE LAMPA WISZĄCA SREBRNA/SILVER;2011006019406;0;-
003064-005288;MD1712-1L-SILVER WIRE LAMPA WISZĄCA SREBRNA/SILVER;2011006019420;0;-
003064-005290;20067-WH POLYGON CL 1L SPOT BIAŁY/WHITE;2011006018102;5;-
003064-005291;20068-BK CHUCK DL 2 SQUARE SPOT CZARNY/BLACK;2011006018133;0;-
003064-005292;20069-WH CHUCK DL 4 SQUARE SPOT BIAŁY/WHITE;2011006018140;411;-
003064-005294;50475-CH COLOR SQUARE DL 1 SPOT CHROME;2011006018232;330;-
003064-005295;20077-BK POLYGON CL R SPOT CZARNY/BLACK;2011006018256;0;-
003064-005296;20078-WH/GD DIAMOND WL SPOT BIAŁY-ZŁOTY/WHITE-GOLD;2011006018324;0;-
003064-005300;94361-BK ONEON DL 50-1 SPOT CZARNY/BLACK;2011006018386;543;1008 week 52/2021 |
003064-005301;94361-WH ONEON DL 50-1 SPOT BIAŁY/WHITE;2011006018393;753;-
003064-005302;94362-BK ONEON DL 50-2 SPOT CZARNY/BLACK;2011006018409;336;600 week 52/2021 |
003064-005303;94362-WH ONEON DL 50-2 SPOT BIAŁY/WHITE;2011006018416;396;504 week 52/2021 |
003064-005304;20079-BK OTAN WL S G9 SPOT CZARNY/BLACK;2011006018331;0;-
003064-005305;20080-WH OTAN WL G9 SPOT BIAŁY/WHITE;2011006018362;0;-
003453-006852;Lampa wisząca OVAL RT2103-12;;0;-
003064-007274;P0310-01H-F4GP DONATO LAMPA WISZĄCA;2011004862806;57;29 week 48/2021 | -
003064-007275;P0369-01A-F4GQ PIOLI LAMPA WISZĄCA;2011005469585;0;-
003064-007459;P0386-04A-B5AC GIANNA LAMPA WISZĄCA;2011005470246;0;-
003064-007591;90841 TRANSFER WL KINKIET BIAŁY/WHITE;2011005668575;299;-
003064-007656;MT57054-1A SEDA LAMPA STOŁOWA BIAŁA;2011006050898;0;-
003064-007808;CS-N096-WH PROVO LAMPA STOŁOWA BIAŁA/WHITE;2011006018997;0;-
003064-007809;CS-W088L-M-BL SHELF KINKIET CZARNY/BLACK;2011006019000;0;-
003064-007810;CS-W088L-M-WH SHELF KINKIET BIAŁY/WHITE;2011006019017;16;-
003064-007823;50630 BOX LAMPA SUFITOWA CL G9 RD CZARNA/BLACK;2011004425575;268;-
003064-007848;94364-BK ONEON DL 111-2 SPOT CZARNY/BLACK;2011006018478;426;800 week 52/2021 |
003064-007849;20077-GD POLYGON CL R SPOT ZŁOTY/GOLD;2011006018270;0;-
003064-007851;20077-AL POLYGON CL R SPOT ALU/ALU;2011006018263;127;-
003064-007852;20077-WH POLYGON CL R SPOT BIAŁY/WHITE;2011006018249;0;-
003064-007853;94363-BK ONEON DL 111-1 SPOT CZARNY/BLACK;2011006018430;1112;-
003064-007854;94363-WH ONEON DL 111-1 SPOT BIAŁY/WHITE;2011006018447;321;-
003064-007856;20079-WH OTAN WL S G9 SPOT BIAŁY/WHITE;2011006018348;0;-
003064-007863;20068-WH CHUCK DL 2 SQUARE SPOT BIAŁY/WHITE;2011006018126;239;-
003064-007910;94364-WH ONEON DL 111-2 SPOT BIAŁY/WHITE;2011006018485;26;400 week 52/2021 |
003064-007918;20067-AL POLYGON CL 1L SPOT ALU/ALU;2011006018119;356;-
003064-008036;20067-BK POLYGON CL 1L SPOT CZARNY/BLACK;2011006018096;0;-
003064-008037;20069-BK CHUCK DL 4 SQUARE SPOT CZARNY/BLACK;2011006018157;51;-
003064-008048;PL170855-5 PONTA LAMPA SUFITOWA;2011006019765;126;-
003064-008059;PL170826-6 MERLO LAMPA SUFITOWA;2011006019796;0;150 January 2022 | -
003064-008065;L170221-3 RESINA LAMPA WISZĄCA;2011006019789;0;150 January 2022 | -
003064-008070;CK170901-2 REDON LAMPA SUFITOWA;2011006019949;34;-
003064-008071;CK170901-1 REDON LAMPA SUFITOWA;2011006019932;64;120 January 2022 | -
003064-008072;L170402-6 CLORIN LAMPA WISZĄCA;2011006019673;0;-
003064-008074;PL170511-3 BELLE LAMPA SUFITOWA;2011006019697;0;200 January 2022 | -
003064-008075;PL170514-2 BELLE LAMPA WISZĄCA;2011006019666;0;150 January 2022 | -
003064-008077;CK171206-1 MARTIN LAMPA SUFITOWA;2011006019819;0;216 January 2022 | -
003064-008078;TK171206-2 MARTIN LAMPA SUFITOWA;2011006019826;0;204 January 2022 | -
003064-008079;TK171206-3 MARTIN LAMPA SUFITOWA;2011006019833;0;204 January 2022 | -
003064-008080;TK171206-4 MARTIN LAMPA SUFITOWA;2011006019840;3;-
003064-008081;CK170901-4 REDON LAMPA SUFITOWA;2011006019963;1;-
003064-008086;PL170855-4 PONTA LAMPA SUFITOWA;2011006019772;0;-
003064-008087;L171207-5 MARTIN LAMPA WISZĄCA;2011006019802;32;-
003064-008179;CK170815-1 TOLEDO  LAMPA SUFITOWA;2011006019895;0;168 January 2022 | -
003064-008180;TK170815-2 TOLEDO  LAMPA SUFITOWA;2011006019901;4;108 January 2022 | -
003064-008181;TK170815-3 TOLEDO  LAMPA SUFITOWA;2011006019918;0;108 January 2022 | -
003064-008182;CK170815-4 TOLEDO  LAMPA SUFITOWA;2011006019925;0;104 January 2022 | -
003064-008185;20071-BK BOXY DL 1 SPOT CZARNY/BLACK;2011006018706;1122;-
003064-008186;20071-WH BOXY DL 1 SPOT BIAŁY/WHITE;2011006018690;955;-
003064-008206;20072-WH BOXY DL 2 SPOT BIAŁY/WHITE;2011006018713;0;-
003064-008207;20072-BK BOXY DL 2 SPOT CZARNY/BLACK;2011006018720;0;-
003064-008208;20074-BK BOXY CL 1 SPOT CZARNY/BLACK;2011006018751;35;-
003064-008209;20075-BK BOXY CL 2 SPOT CZARNY/BLACK;2011006018775;344;-
003064-008212;20076-BK BOXY CL 4 SPOT CZARNY/BLACK;2011006018805;0;-
003064-008076;L171209-5 RECTAN  LAMPA WISZĄCA;2011006019710;0;-
003064-008183;CK99603A-3 SPAZIO SPOT;2011005479881;1;108 January 2022 | -
003064-008187;20074-WH BOXY CL 1 SPOT BIAŁY/WHITE;2011006018768;161;-
003064-008211;20076-WH BOXY CL 4 SPOT BIAŁY/WHITE;2011006018799;89;-
003064-008113;DC-6042B BERO LAMPA WISZĄCA;2011006001579;1;-
003064-008210;20075-WH BOXY CL 2 SPOT BIAŁY/WHITE;2011006018782;98;-
003842-008574;Lampa sufitowa DL-C415TXW WiFi || DALEN;2017001927982;0;-
003842-008580;Lampa sufitowa DL-C515TXW || DALEN;2017001928040;0;-
003842-008578;Lampa sufitowa DL-C406T || DALEN;2017001928026;0;-
003842-008581;Lampa biurkowa DL-1X || DALEN;2017001928057;3;-
003842-008575;Lampa sufitowa DL-C319TW WiFi || DALEN;2017001927999;0;-
003842-008579;Lampa sufitowa DL-C515TW || DALEN;2017001928033;0;-
003842-008582;Lampa sufitowa DL-2S Plus (silver) || DALEN;2017001928064;0;-
003842-008576;Lampa sufitowa DL-C319TXW WiFi || DALEN;2017001928002;0;-
003842-008577;Lampa sufitowa DL-C216TW WiFi || DALEN;2017001928019;0;-
003842-008571;Lampa sufitowa DL-C205T || DALEN;2017001927951;0;-
003842-008570;Lampa sufitowa DL-S28TX || DALEN;2017001927944;0;-
003842-008572;Lampa sufitowa DL-C205TX || DALEN;2017001927968;0;-
003842-008569;Lampa sufitowa DL-S28T || DALEN;2017001927937;0;-
003842-008573;Lampa sufitowa DL-C415T || DALEN;2017001927975;0;-
003064-007887;GU16016-3TU-BK GASTER LAMPA SUFITOWA;2011006027418;28;204 week 50/2021 | 300 in production |
003064-007891;P14030C-5 HORTA LAMPA WISZĄCA;2011006027579;0;-
003064-008238;P15079-1F JOSE LAMPA PODŁOGOWA;2011006027647;28;-
003064-007866;P16150-D30 SINES LAMPA WISZĄCA;2011006027609;57;-
003064-007883;P15079-D22 JOSE LAMPA WISZĄCA;2011006027623;0;-
003064-007909;F16026-1T LINO LAMPA STOŁOWA;2011006027890;0;-
003064-007896;G916008-1R NICOLA KINKIET;2011006027746;84;-
003064-007901;CL12029-D40-WH CLARA LAMPA SUFITOWA;2011006027807;56;300 week 50/2021 |
003064-007903;WL243B-3P BRUNO LAMPA WISZĄCA;2011006027968;9;-
003064-007874;R5017002-1R OLTEN KINKIET;2011006027319;19;200 week 50/2021 |
003064-008243;CL13110-D40 LUCIO LAMPA SUFITOWA;2011006027821;0;-
003064-007900;CL12029-D40-BK CLARA LAMPA SUFITOWA;2011006027791;3;300 week 50/2021 |
003064-007898;CL12029-D30-BK CLARA LAMPA SUFITOWA;2011006027777;158;200 week 50/2021 |
003064-008242;CL13110-D60 LUCIO LAMPA SUFITOWA;2011006027838;191;-
003064-007892;CL16157-3 CLOE LAMPA SUFITOWA;2011006027760;0;252 in production |
003064-008236;LED17008-4R BERN LAMPA SUFITOWA;2011006027272;4;-
003064-007897;G916008-5CL NICOLA LAMPA SUFITOWA;2011006027753;192;-
003064-007876;R5017002-5CL OLTEN LAMPA SUFITOWA;2011006027388;76;-
003064-008240;T51S-WH GARITA LAMPA STOŁOWA;2011006027876;1;300 week 50/2021 | 300 in production |
003064-008247;WL16016 NOBLI KINKIET;2011006027845;0;210 week 50/2021 | 255 in production |
003064-007875;R5017002-2S OLTEN LAMPA SUFITOWA;2011006027371;15;200 week 50/2021 |
003064-007899;CL12029-D30-WH CLARA LAMPA SUFITOWA;2011006027784;0;200 week 50/2021 | 300 in production |
003064-007894;G917006-2B BALVE LAMPA SUFITOWA;2011006027722;9;-
003064-007879;P15091-5 CLAMART LAMPA WISZĄCA;2011006027555;0;-
003064-007882;P17106-7 JENA LAMPA SUFITOWA;2011006027531;0;-
003064-007880;LED16046-1R AQUA KINKIET;2011006027227;0;-
003064-007908;F16026 LINO LAMPA PODŁOGOWA;2011006027883;0;300 week 50/2021 | 250 in production |
003064-007906;P15103-1CL-D45 AGGEO LAMPA SUFITOWA;2011006027708;0;250 in production |
003064-008230;GU16016-3TU-WH GASTER LAMPA SUFITOWA;2011006027456;0;204 week 50/2021 | 300 in production |
003064-008231;GU16016-2TU-WH GASTER LAMPA SUFITOWA;2011006027449;0;204 week 50/2021 | 300 in production |
003064-007889;GU16016-1R-WH GASTER KINKIET;2011006027432;19;208 week 50/2021 | 304 in production |
003064-007904;P16151-BK ELSTRA LAMPA WISZĄCA;2011006027517;0;200 week 50/2021 |
003064-007865;P16182-D57 VERTO LAMPA WISZĄCA;2011006027661;226;-
003064-007871;P17084-D20 CUBE LAMPA WISZĄCA;2011006027586;218;-
003064-008232;GU16016-4TU2-WH GASTER LAMPA SUFITOWA;2011006027463;0;200 week 50/2021 | 256 in production |
003064-007864;P17194-3 ALBI LAMPA WISZĄCA;2011006027487;0;250 in production |
003064-007886;GU16016-2TU-BK GASTER LAMPA SUFITOWA;2011006027401;32;204 week 50/2021 | 300 in production |
003064-007890;P14030C HORTA LAMPA WISZĄCA;2011006027562;14;-
003064-007907;P12105-L-5 GIULIO LAMPA WISZĄCA;2011006027944;196;-
003064-007888;GU16016-4TU2-BK GASTER LAMPA SUFITOWA;2011006027425;76;200 week 50/2021 | 252 in production |
003064-007884;P17135 NANCY LAMPA WISZĄCA;2011006027654;0;-
003064-007895;G917006-3R BALVE LAMPA SUFITOWA;2011006027739;137;-
003064-007878;P16151-WH ELSTRA LAMPA WISZĄCA;2011006027524;206;-
003064-008229;LED16032A-1R DRISO KINKIET;2011006027289;0;216 week 50/2021 |
003064-007893;G917006-1R BALVE KINKIET;2011006027715;254;-
003064-007902;CL13077C-4(B) POTOS LAMPA SUFITOWA;2011006027814;0;200 week 50/2021 |
003064-007872;P17212 MARL LAMPA WISZĄCA;2011006027593;92;-
003064-008239;P15079-1T JOSE LAMPA BIURKOWA;2011006027630;40;-
003064-008241;T51S-BK GARITA LAMPA STOŁOWA;2011006027869;0;300 week 50/2021 | 300 in production |
003064-007869;P17194-1W ALBI KINKIET;2011006027470;96;-
003064-008228;LED17008-1R BERN KINKIET;2011006027258;0;-
003064-007905;P16194-BK BLOIS LAMPA WISZĄCA;2011006027494;155;200 week 50/2021 |
003064-008234;LED16032A-3SP DRISO LAMPA SUFITOWA;2011006027302;74;201 week 50/2021 |
003064-007873;P16180A-D44 VERTO LAMPA WISZĄCA;2011006027678;0;-
003064-007885;GU16016-1R-BK GASTER KINKIET;2011006027395;82;208 week 50/2021 | 304 in production |
003064-008235;LED16032A-2TU DRISO LAMPA SUFITOWA;2011006027296;0;204 week 50/2021 |
003064-008528;P0461-09C-B5F4 LOYA LAMPA WISZĄCA CHROME;2011006187761;57;-
003064-008382;P0354-06B-F4QL LUCAS LAMPA WISZĄCA SILVER;2011005666618;75;100 week 52/2021 | -
003064-009161;SL598-CH MILO LAMPA PODŁOGOWA;2011006390611;0;-
003064-009086;PL180407-1 PLATT LAMPA WISZĄCA;2011006297477;0;304 January 2022 | -
003064-009087;PL180407-3 PLATT LAMPA WISZĄCA;2011006297491;0;200 January 2022 | -
003064-009095;CK180113-2 SPARKLES LISTWA;2011006297569;2;-
003064-009106;15010002 LIMA LAMPA WISZĄCA BIAŁA/WHITE;2011006345550;194;-
003064-009107;15010003 LIMA LAMPA WISZĄCA BIAŁA/WHITE;2011006345567;193;-
003064-009108;12080021 BELLIS LAMPA SUFITOWA;2011006345574;251;-
003064-009109;12080022 BELLIS LAMPA SUFITOWA;2011006345581;443;-
003064-009110;12100006-SL SIERRA LAMPA SUFITOWA SREBRNA/SILVER;2011006345604;349;-
003064-009111;12100005-GD SIERRA LAMPA SUFITOWA ZŁOTA/GOLD;2011006345611;0;450 in production | 200 in production | -
003064-009112;12100005-SL SIERRA LAMPA SUFITOWA SREBRNA/SILVER;2011006345628;440;-
003064-009114;12100006-GD SIERRA LAMPA SUFITOWA ZŁOTA/GOLD;2011006345598;0;450 in production | 300 in production | -
003064-009118;P0461-01E-S8S8 ONE LAMPA WISZĄCA BIAŁA/WHITE;2011006377162;10;200 January 2022 | -
003064-009119;P0461-01E-F4F4 ONE LAMPA WISZĄCA CHROME;2011006377179;0;300 January 2022 | -
003064-009120;P0461-01E-F7F7 ONE LAMPA WISZĄCA ZŁOTA/FRENCH GOLD;2011006377186;0;400 January 2022 | -
003064-009121;P0461-09L-B5S8 ONE LAMPA WISZĄCA BIAŁA/WHITE;2011006377193;54;50 January 2022 | -
003064-009122;P0461-09L-B5F4 ONE LAMPA WISZĄCA CHROME;2011006377209;90;50 January 2022 | -
003064-009123;P0461-09L-B5F7 ONE LAMPA WISZĄCA ZŁOTA/FRENCH GOLD;2011006377216;0;20 January 2022 | 50 in production | -
003064-009124;P0461-11L-B5S8 ONE LAMPA WISZĄCA BIAŁA/WHITE;2011006377223;0;50 January 2022 | -
003064-009125;P0461-11L-B5F4 ONE LAMPA WISZĄCA CHROME;2011006377230;35;32 January 2022 | 68 in production | -
003064-009126;P0461-11L-B5F7 ONE LAMPA WISZĄCA ZŁOTA/FRENCH GOLD;2011006377247;4;50 January 2022 | -
003064-009127;W0461-02E-S8S8 ONE KINKIET BIAŁY/WHITE;2011006377254;29;100 January 2022 | -
003064-009128;W0461-02E-F4F4 ONE KINKIET CHROME;2011006377261;0;100 January 2022 | -
003064-009129;W0461-02E-F7F7 ONE KINKIET ZŁOTY/FRENCH GOLD;2011006377278;0;400 January 2022 | -
003064-009130;P0454-08D-SDAA RIANO LAMPA WISZĄCA;2011006377285;63;-
003064-009132;W0461-01A-F4F4 LOYA KINKIET CHROME;2011006377308;101;-
003064-009133;W0461-01A-F7F7 LOYA KINKIET ZŁOTY/FRENCH GOLD;2011006377315;283;-
003064-009134;W0461-01A-S8S8 LOYA KINKIET BIAŁY/WHITE;2011006377322;192;-
003064-009135;W0461-02B-F4F4 LOYA KINKIET CHROME;2011006377339;48;100 January 2022 | -
003064-009136;W0461-02B-S8S8 LOYA KINKIET BIAŁY/WHITE;2011006377346;240;-
003064-009137;W0461-02B-L8L8 LOYA KINKIET CZARNY/BLACK;2011006377353;267;200 January 2022 | -
003064-009138;W0461-02B-F7F7 LOYA KINKIET ZŁOTY/FRENCH GOLD;2011006377360;0;200 January 2022 | -
003064-009159;HP1799-30-BL ATOM LAMPA WISZĄCA;2011006390598;0;-
003064-009139;C0465-05D-B5AC VENTUS LAMPA SUFITOWA;2011006377377;73;99 week 52/2021 | -
003064-009140;P0465-05D-F4AC VENTUS LAMPA WISZĄCA;2011006377384;66;49 week 48/2021 | -
003064-009141;W0465-01B-B5AC VENTUS KINKIET;2011006377391;86;50 week 48/2021 | 100 week 50/2021| -
003064-008339;RLX93410-1 FUSION LAMPA SUFITOWA;2011006161785;221;100 in production | -
003064-009175;P15090A-1W PARIA KINKIET;2011006389875;2;200 week 50/2021 |
003064-009189;CL15008A-3CLA COLTEN LAMPA SUFITOWA;2011006390277;0;-
003064-009176;P18230-D60-BK ALICE LAMPA WISZĄCA;2011006389882;0;300 in production |
003064-009274;P0488-01A-F4AC ROCK LAMPA WISZĄCA;2011006485874;78;-
003064-009295;ACGU10-138 TUBIA SL SPOT BIAŁY/WHITE;2011006489292;0;-
003064-009261;YSC06 CORIA LAMPA WISZĄCA;2011006505206;0;-
003064-009260;YSC04 CEUTA LAMPA WISZĄCA;2011006505190;0;-
003064-009313;P15322A-D30;2011006567884;30;-
003064-009282;ACGU10-133 TUBY SL SPOT CZARNY/BLACK;2011006489230;0;-
003064-009303;AWG9-048 LUXE WL KINKIET CHROM;2011006489582;74;-
003064-009304;AWG9-046 LUXE WL KINKIET BIAŁY/WHITE;2011006489599;6;-
003064-009305;AWG9-047 LUXE WL KINKIET CZARNY/BLACK;2011006489605;0;-
003064-009280;W0488-01A-B5AC ROCK KINKIET;2011006486017;51;50 week 52/2021 | 50 week 50/2021 |
003064-009302;ACGU10-143 MAC SL 2 SPOT CZARNY/BLACK;2011006489681;0;-
003064-009275;P0488-01B-U8AC ROCK LAMPA WISZĄCA;2011006485881;88;-
003064-009298;ACGU10-127 TORI SL 1 DUO SPOT CZARNO-ZŁOTY/BLACK-GOLD;2011006489148;0;-
003064-009277;P0488-03D-B5AC ROCK LAMPA WISZĄCA;2011006485973;28;-
003064-009299;ACGU10-140 MAC SL 1 SPOT BIAŁY/WHITE;2011006489650;12;-
003064-009306;CARACAS CEILING P17200;2011006567846;0;-
003064-009286;ACGU10-131 QUBY SL SPOT CZARNY/BLACK;2011006489216;32;-
003064-009289;ACGU10-136 RONCUB SL SPOT BIAŁY/WHITE;2011006489278;0;-
003064-009288;ACGU10-065 RONBOX SL SPOT CZARNY/BLACK;2011006489643;1;-
003064-009297;ACGU10-126 TORI SL 1 DUO SPOT BIAŁO-ZŁOTY/WHITE-GOLD;2011006489131;0;-
003064-009301;ACGU10-142 MAC SL 2 SPOT BIAŁY/WHITE;2011006489674;0;-
003064-009291;ACGU10-062 RONDUO SL SPOT BIAŁY/WHITE;2011006489612;0;-
003064-009278;P0488-04F-B5AC ROCK LAMPA WISZĄCA;2011006485997;58;-
003064-008383;P0461-01A-K4K4 LOYA LAMPA WISZĄCA ZŁOTA/SHINY GOLD;2011006147376;73;150 January 2022 | 150 in production | -
003064-009300;ACGU10-141 MAC SL 1 SPOT CZARNY/BLACK;2011006489667;17;-
003064-009285;ACGU10-130 QUBY SL SPOT BIAŁY/WHITE;2011006489193;59;-
003064-009283;ACGU10-128 PARC SL SPOT BIAŁY/WHITE;2011006489162;0;-
003064-009287;ACGU10-064 RONBOX SL SPOT BIAŁY/WHITE;2011006489636;0;-
003064-009279;T0488-01A-U8AC ROCK LAMPA STOŁOWA;2011006485898;0;-
003064-009307;P17200-3W CARACAS KINKIET;2011006567853;209;-
003064-009284;ACGU10-129 PARC SL SPOT CZARNY/BLACK;2011006489186;0;-
003064-009290;ACGU10-137 RONCUB SL SPOT CZARNY/BLACK;2011006489285;0;-
003064-009276;P0488-01F-F4AC ROCK LAMPA WISZĄCA;2011006485935;307;-
003064-009294;ACGU10-135 RONTUB SL SPOT CZARNY/BLACK;2011006489254;0;-
003064-009292;ACGU10-063 RONDUO SL SPOT CZARNY/BLACK;2011006489629;4;-
003064-009308;P17266-6 Quito lampa sufitowa;2011006567815;91;-
003064-009309;P18334-D40 Coro lampa wisząca;2011006567976;0;300 week 50/2021 |
003064-009310;EDES TABLE T110810;2011006567969;0;200 week 50/2021 |
003064-009311;Lampa wisząca SANTI P17197-6;2011006567822;71;-
003064-009312;Lampa sufitowa SANTI P17197-6CL;2011006567839;0;-
003064-009314;A153 EVORA LAMPA WISZĄCA;2011006507804;0;-
003064-009315;A153-L EVORA LAMPA WISZĄCA;2011006507811;0;-
003064-009316;A012-S BRAGA LAMPA WISZĄCA;2011006507781;0;-
003064-009317;A044A-L GUARDA LAMPA WISZĄCA;2011006507835;0;-
003064-009318;A044A-S GUARDA LAMPA WISZĄCA;2011006507828;0;-
003064-009319;A146 CHAVEZ LAMPA WISZĄCA;2011006507798;0;-
003064-009443;CL16022-1 BRAVA LAMPA SUFITOWA;2011006390246;0;204 week 50/2021 |
003064-009171;P110839-D30 CASTO LAMPA WISZĄCA;2011006389820;0;-
003064-009320;A093-L MADA LAMPA WISZĄCA;2011006507774;0;-
003064-009174;P15090-5 PARIA LAMPA WISZĄCA;2011006389868;0;200 week 50/2021 |
003064-009186;CL15068SQ-D40 MOA LAMPA SUFITOWA;2011006390239;0;250 in production |
003064-009170;P14071-D35 OVAL LAMPA WISZĄCA;2011006389813;0;-
003064-009178;F18014-GU10-BK TENSO LAMPA PODŁOGOWA;2011006389905;0;200 + 200 week 50/2021 |
003064-009169;P16130A-5 JIL LAMPA WISZĄCA;2011006389806;1;-
003064-009179;F18014-GU10-CHROME TENSO LAMPA PODŁOGOWA;2011006389912;0;-
003064-009177;P749A LIA LAMPA SUFITOWA;2011006389899;37;-
003064-009187;CL16022-3 BRAVA LAMPA SUFITOWA;2011006390253;0;252 in production |
003064-009173;P15090-3 PARIA LAMPA WISZĄCA;2011006389851;23;250 in production |
003064-009182;T18057-WH EXPIR LAMPA STOŁOWA;2011006389967;0;-
003064-009172;P15090-1 PARIA LAMPA WISZĄCA;2011006389844;0;200 week 50/2021 |
003064-009183;CL16086-1PD50-CHROME DALBERT LAMPA WISZĄCA;2011006389974;73;-
003064-009185;CL15068C-D40 MOA LAMPA SUFITOWA;2011006390185;13;250 in production |
003064-009188;CL16022-6 BRAVA LAMPA SUFITOWA;2011006390260;0;200 week 50/2021 |
003064-009269;P0389-01D-F4AC GEM LAMPA WISZĄCA;2011006485614;116;200 week 48/2021 | 43 week 48/2021 | 157 week 50/2021| -
003064-009258;W0480-02B-B5AC ANZIO KINKIET;2011006486215;0;100 week 50/2021| -
003064-009324;P18055 SKIN LAMPA WISZĄCA;2011006389837;22;-
003064-009271;P0389-01D-L7AC GEM LAMPA WISZĄCA;2011006486147;0;100 week 50/2021 |
003064-009322;A001 SINTRA LAMPA WISZĄCA;2011006507767;0;-
003064-009240;P0475-05A-F4AC CORATO LAMPA WISZĄCA;2011006485768;0;-
003064-009001;P14120-1 SILLO LAMPA WISZĄCA;2011006221748;0;256 in production |
003064-009238;17106/2W-CHR AMEDEO KINKIET CHROM/CHROME;2011006485294;385;200 week 51/2021 | -
003064-009249;P0465-05C-F4AC VENTUS LAMPA WISZĄCA;2011006485492;51;22 week 48/2021 | 28 week 51/2021 -
003064-009002;P14120-1-D40 SILLO LAMPA WISZĄCA;2011006221755;0;250 in production |
003064-009323;F074 TREVE LAMPA WISZĄCA;2011006505237;0;-
003064-009234;FC17106/4+1-GLD AMEDEO LAMPA SUFITOWA ZŁOTA/GOLD;2011006485133;471;200 week 51/2021 | -
003064-009247;W0475-02A-F4AC CORATO KINKIET;2011006485867;0;-
003064-009263;YSC23 SORIA LAMPA WISZĄCA;2011006505220;0;-
003064-009246;W0475-02A-F7AC CORATO KINKIET;2011006485850;0;-
003064-009230;P0389-03D-F7AC GEM LAMPA WISZĄCA;2011006485621;0;100 week 52/2021 | -
003064-009231;P0389-03D-F4AC GEM LAMPA WISZĄCA;2011006485638;4;42 week 50/2021 |
003064-009181;T15027-1P MEGAN LAMPA WISZĄCA;2011006389950;174;-
003064-009239;17106/2W-GLD AMEDEO KINKIET ZŁOTY/GOLD;2011006485362;65;200 week 51/2021 | -
003064-009268;P0389-01D-0FD2 GEM LAMPA WISZĄCA;2011006486154;0;99 week 52/2021 | -
003064-009272;P0389-03D-0FD2 GEM LAMPA WISZĄCA;2011006486161;49;-
003064-009237;17106/3+1-CHR AMEDEO LAMPA WISZĄCA CHROM/CHROME;2011006485256;67;220 week 51/2021 | -
003064-009270;P0389-01D-F7AC GEM LAMPA WISZĄCA;2011006485607;27;100 week 48/2021 | 100 week 52/2021 | -
003064-009011;T16079 SALLY LAMPA STOŁOWA;2011006221854;5;200 week 50/2021 |
003064-008338;RLX94775-3 COSI LAMPA SUFITOWA;2011006161792;144;204 week 46/2021 | 102 in production | -
003064-009009;P17247-D40 MELLY LAMPA WISZĄCA;2011006221830;0;-
003064-009010;P17247-1F MELLY LAMPA PODŁOGOWA;2011006221847;0;-
003064-009006;P12082D-D25 IVIA LAMPA WISZĄCA;2011006221793;0;250 in production |
003064-009003;P14120-3 SILLO LAMPA WISZĄCA;2011006221762;141;-
003064-008935;P17127-4 TIFANNY LAMPA WISZĄCA;2011006221816;0;400 week 50/2021 | 230 in production |
003064-009008;P12168I AMY LAMPA WISZĄCA;2011006221823;0;-
003064-009007;P12082D-3 IVIA LAMPA WISZĄCA;2011006221809;12;250 in production |
003064-008205;20073-WH BOXY DL 4 SPOT BIAŁY/WHITE;2011006018737;323;-
003064-008204;20073-BK BOXY DL 4 SPOT CZARNY/BLACK;2011006018744;416;-
003064-009499;Lampa wisząca LORETO P630B;2011006567891;0;-
003064-009503;P110718-D40 MANITO LAMPA WISZĄCA;2011006567808;6;200 week 50/2021 | 300 in production |
003064-009502;Lampa wisząca SURIN P18143A;2011006567860;172;200 week 50/2021 |
003064-009500;Lampa wisząca SURIN P18143B;2011006567877;73;200 week 50/2021 | 250 in production |
003064-009235;17106/4+1-CHR AMEDEO LAMPA WISZĄCA CHROM/CHROME;2011006485140;15;300 week 51/2021 | -
003064-009504;1601 LAMPA BIURKOWA CZARNA/BLACK;2011006524436;0;1620 in production | -
003064-009507;Lampa biurkowa LED H1848;2011006524405;0;1024 in production | -
003064-009509;Lampa biurkowa LED H1869;2011006524382;0;1020 in production | -
003064-009506;H1408S-WH LAMPA BIURKOWA BIAŁA/WHITE;2011006524412;0;600 in production | -
003064-009508;H1633 LAMPA BIURKOWA CZARNA/BLACK;2011006524399;0;1020 in production | -
003064-009505;H1408S-BCK LAMPA BIURKOWA CZARNA/BLACK;2011006524429;0;600 in production | -
003064-009241;P0475-06A-F7AC CORATO LAMPA WISZĄCA;2011006485775;0;-
003064-009262;YSC14 ROTA LAMPA WISZĄCA;2011006505213;0;-
003064-009266;P0491-09A-F4AC CENTAURUS LAMPA WISZĄCA;2011006486062;0;-
003064-009232;P0389-05D-F4AC GEM LAMPA WISZĄCA;2011006485652;7;50 week 50/2021| -
003064-009243;P0475-10C-F7AC CORATO LAMPA WISZĄCA;2011006485799;0;-
003064-009236;17106/4+1-GLD AMEDEO LAMPA WISZĄCA ZŁOTA/GOLD;2011006485249;372;582 week 51/2021 | -
003064-009233;FC17106/4+1-CHR AMEDEO LAMPA SUFITOWA CHROM/CHROME;2011006485126;35;200 week 51/2021 | -
