kod towaru;nazwa;ean;stan;dostepnosc
003064-009244;P0475-10C-F4AC CORATO LAMPA WISZĄCA;2011006485805;0;-
003064-009256;P0480-07A-F4AC ANZIO LAMPA WISZĄCA;2011006486192;0;50 week 52/2021 | -
003064-009255;P0480-04A-F4D7 ANZIO LAMPA WISZĄCA;2011006486185;45;50 week 48/2021 | -
003064-009242;P0475-06A-F4AC CORATO LAMPA WISZĄCA;2011006485782;0;-
003064-009273;P0389-05D-F7AC GEM LAMPA WISZĄCA;2011006485645;23;43 week 48/2021 | 57 week 52/2021 | -
003064-009257;P0480-09C-F4AC ANZIO LAMPA WISZĄCA;2011006486208;6;50 week 52/2021 | -
003064-009265;C0491-06A-F7AC CENTAURUS LAMPA SUFITOWA;2011006486048;0;-
003064-009264;C0491-06A-F4AC CENTAURUS LAMPA SUFITOWA;2011006486031;0;-
003064-009259;YSC01 ALMERIA LAMPA WISZĄCA;2011006505183;0;-
003064-009245;P0475-15C-F4AC CORATO LAMPA WISZĄCA;2011006485843;19;-
003064-009254;P0480-04A-F4AC ANZIO LAMPA WISZĄCA;2011006486178;51;50 week 48/2021 | -
003064-009248;C0465-05C-B5AC VENTUS LAMPA SUFITOWA;2011006485485;0;50 week 51/2021 -
003064-009497;Lampa sufitowa ARTIG CL16101;2011006567914;0;201 week 50/2021 |
003842-009511;Lampa sufitowa DL-2Z Plus (gold) || DALEN;2017001928491;2;-
003842-009514;Lampa sufitowa DL-2D Plus (silver) || DALEN;2017001928521;0;-
003842-009518;Lampa sufitowa DL-C519TXW WiFi || DALEN;2017001928569;0;-
003842-009521;Lampa wisząca DL-2S Plus D (gold) || DALEN;2017001928590;0;-
003842-009519;Lampa sufitowa DL-C213T(X)/DL-S28TX || DALEN;2017001928576;0;-
003842-009517;Lampa sufitowa DL-C219T || DALEN;2017001928552;0;-
003842-009512;Lampa sufitowa DL-2D Plus D (silver) || DALEN;2017001928507;1;-
003842-009164;Lampa wisząca DL-2S Plus D (silver) || DALEN;2017001928828;1;-
003842-009516;Lampa sufitowa DL-C219TX || DALEN;2017001928545;1;-
003842-009510;Lampa sufitowa DL-2Z Plus (silver) || DALEN;2017001928484;0;-
003842-009515;Lampa sufitowa DL-2D Plus (gold) || DALEN;2017001928538;1;-
003064-009481;TL-749P-I CELIA LAMPA WISZĄCA;2011006507965;0;-
003064-009921;CK20181015-1 NIASA KINKIET;2011006536200;0;264 January 2022 | -
003064-009922;CK20181015-2 NIASA LAMPA SUFITOWA;2011006536217;0;252 January 2022 | -
003064-009923;CK20181015-3 NIASA LAMPA SUFITOWA;2011006536224;0;252 January 2022 | -
003064-009924;CK20181015-4 NIASA LAMPA SUFITOWA;2011006536231;0;252 January 2022 | -
003064-009479;TL-1061P-B ALISA LAMPA WISZĄCA SREBRNA/SILVER;2011006507941;291;-
003064-009911;L180511-3 HURON LAMPA WISZĄCA;2011006536101;0;-
003064-009485;TL-1060P-A GRADA LAMPA WISZĄCA BIAŁA/WHITE;2011006508009;164;-
003064-009480;TL-770P-C ANITA LAMPA WISZĄCA BIAŁA/WHITE;2011006507958;95;-
003064-009484;TL-1283P-C ARAN LAMPA WISZĄCA SREBRNA/SILVER;2011006507996;141;-
003064-009926;CK180610-2 POSO LAMPA SUFITOWA;2011006536255;0;156 January 2022 | -
003064-009925;CK180610-1 POSO KINKIET;2011006536248;0;168 January 2022 | -
003064-009916;L180619-2 ONTAR LAMPA WISZĄCA;2011006536156;3;-
003064-009927;CK180610-3 POSO LAMPA SUFITOWA;2011006536262;0;156 January 2022 | -
003064-009928;CK180610-4 POSO LAMPA SUFITOWA;2011006536279;0;102 January 2022 | -
003064-009932;CK180612-4 POSO LAMPA SUFITOWA;2011006536354;0;100 January 2022 | -
003064-009929;CK180612-1 POSO KINKIET;2011006536316;0;120 January 2022 | -
003064-009930;CK180612-2 POSO LAMPA SUFITOWA;2011006536323;0;156 January 2022 | -
003064-009931;CK180612-3 POSO LAMPA SUFITOWA;2011006536347;0;108 January 2022 | -
003064-009910;PL170513-2 BELLE LAMPA WISZĄCA;2011006536088;39;-
003064-009912;BL180314 CANTO LAMPA SUFITOWA;2011006536118;0;-
003064-009918;PL180414-3 CHELAN LAMPA WISZĄCA;2011006536170;0;100 January 2022 | -
003064-009914;B180607-2 MALAWI LAMPA SUFITOWA;2011006536132;0;-
003064-009909;PL170856-6 COMET LAMPA SUFITOWA;2011006536064;0;-
003064-009913;B180609-3 MALAWI LAMPA SUFITOWA;2011006536125;0;-
003064-009915;L180621-3 MATANA LAMPA WISZĄCA;2011006536149;0;-
003064-009920;TL180515-2 TINA LAMPA STOŁOWA;2011006536194;0;100 January 2022 | -
003064-009919;PL180414-3A CHELAN LAMPA WISZĄCA;2011006536187;0;-
003064-009917;PL180414-1 CHELAN LAMPA WISZĄCA;2011006536163;0;104 January 2022 | -
003064-010537;RLB94875-1W CLOE KINKIET;2011006699356;373;800 week 46/2021 | 200 in production | -
003064-010523;ACGU10-117 BOX2 PLAFON CZARNY/BLACK;2011006700281;263;-
003064-010524;ACGU10-144 SCOPE1 PLAFON BIAŁY/WHITE;2011006700298;459;-
003064-010528;ACGU10-148 TURY1 PLAFON BIAŁY/WHITE;2011006700335;190;-
003064-010526;ACGU10-146 RONDIA2 PLAFON BIAŁY/WHITE;2011006700311;215;-
003064-010531;ACGU10-151 SCOPY1 PLAFON CZARNY/BLACK;2011006700366;0;210 week 52/2021 |
003064-010529;ACGU10-149 TURY1 PLAFON CZARNY/BLACK;2011006700342;153;-
003064-010522;ACGU10-116 BOX2 PLAFON BIAŁY/WHITE;2011006700274;379;-
003064-009876;ACGU10-114 BOX1 PLAFON BIAŁY/WHITE;2011006700250;81;400 week 52/2021 |
003064-010533;ACGU10-153 BUELL1 PLAFON CZARNY/BLACK;2011006700380;34;-
003064-010530;ACGU10-150 SCOPY1 PLAFON BIAŁY/WHITE;2011006700359;144;-
003064-010527;ACGU10-147 RONDIA2 PLAFON CZARNY/BLACK;2011006700328;237;-
003064-010532;ACGU10-152 BUELL1 PLAFON BIAŁY/WHITE;2011006700373;14;-
003064-010521;ACGU10-115 BOX1 PLAFON CZARNY/BLACK;2011006700267;312;304 week 52/2021 |
003064-010525;ACGU10-145 SCOPE1 PLAFON CZARNY/BLACK;2011006700304;480;-
003064-009493;Lampa sufitowa GUARAN G916006-4S;2011006567952;0;-
003064-009495;Lampa sufitowa GUARAN G916006-2S;2011006567938;1;204 week 50/2021 |
003064-009494;Lampa sufitowa GUARAN G916006-3S;2011006567945;13;200 week 50/2021 |
003064-009496;Kinkiet GUARAN G916006-1R;2011006567921;7;-
003064-009498;Lampa sufitowa ROCHA CL14083-6;2011006567907;0;-
003842-010270;Lampa sufitowa DL-2S Plus (gold) II DALEN;6931056703291;2;-
003064-010589;HP1811A-12-PB CANDEL LAMPA WISZĄCA;2011006692517;0;-
003064-010590;HP1408-F5 VASTO LAMPA PODŁOGOWA;2011006692524;0;-
003064-010934;P0389-05E-F7AC GEM LAMPA WISZĄCA ZŁOTA/GOLD;2011006779669;12;-
003064-010939;C0389-01A-0FD2-PL03 GEM LAMPA SUFITOWA J_ANTYCZNY BRĄZ/L_ANTIQUE BRONZE;2011006779775;163;-
003064-010943;P0488-06L-SEAC ROCK LAMPA WISZĄCA CZARNA+ZŁOTA/MATT BLACK+MATT GOLD;2011006779874;0;50 week 52/2021 | -
003064-010937;C0389-01A-L7AC GEM LAMPA SUFITOWA MIEDŹ/ANTIQUE COPPER;2011006779737;0;-
003064-010945;P0488-12P-F4AC ROCK LAMPA WISZĄCA CHROME;2011006779898;0;50 December 2021 | -
003064-010935;P0389-05E-B5AC GEM LAMPA WISZĄCA CHROME;2011006779676;4;50 week 52/2021 | -
003064-010946;P0488-12P-U8AC ROCK LAMPA WISZĄCA ZŁOTA/MATT GOLD;2011006779904;62;50 week 48/2021 | -
003064-010938;C0389-01A-F4AC GEM LAMPA SUFITOWA CHROME;2011006779751;265;-
003064-010809;C0480-07A-B5AC ANZIO LAMPA SUFITOWA CHROME;2011006779843;55;50 week 48/2021 | 50 week 51/2021 -
003064-010944;W0488-01D-SEAC ROCK KINKIET CZARNY+ZŁOTY/MATT BLACK+MATT GOLD;2011006779881;7;52 week 52/2021 | 98 week 50/2021| -
003064-010940;P0476-01A-B5AC-PL03 SPARK LAMPA WISZĄCA CHROME;2011006779799;0;-
003064-010942;P0488-08L-SEAC ROCK LAMPA WISZĄCA CZARNA+ZŁOTA/MATT BLACK+MATT GOLD;2011006779867;58;-
003064-010936;C0389-01A-F7AC GEM LAMPA SUFITOWA ZŁOTA/GOLD;2011006779713;292;100 week 52/2021 | -
003064-010941;W0476-01A-B5AC SPARK KINKIET CHROME;2011006779805;1;-
003064-010540;RLD931031-3 MERANO LAMPA WISZĄCA;2011006699394;228;200 week 46/2021 | 100 in production | -
003064-011108;P19066A-D38 BRESSO LAMPA WISZĄCA;2011006778655;215;-
003064-011109;P19066A-D28 BRESSO LAMPA WISZĄCA;2011006778662;113;-
003064-011112;P19066B-D30 MOON LAMPA WISZĄCA;2011006778693;31;200 week 50/2021 |
003064-011113;P19066B-D25 MOON LAMPA WISZĄCA;2011006778709;23;200 week 50/2021 |
003064-011110;P19066A-D18 BRESSO LAMPA WISZĄCA;2011006778679;69;-
003064-011111;P19066B-D38 MOON LAMPA WISZĄCA;2011006778686;64;200 week 50/2021 |
003064-011266;P0454-08D-STAC RIANO LAMPA WISZĄCA;2011006931142;33;-
003064-011323;MD1921-4A-CLEAR BASTONI LAMPA WISZĄCA CHROME;2011006930527;10;-
003064-011294;P0389-01D-P7AC GEM LAMPA WISZĄCA CZARNY MAT/MATT BLACK;2011006962368;7;-
003064-011268;P0454-09B-SDGF RIANO LAMPA WISZĄCA;2011006931197;106;-
003064-011273;C0506-06A-B5E3 QUASAR LAMPA SUFITOWA ZŁOTA/GOLD;2011006932903;94;-
003064-011299;P0488-01F-F4HF ROCK LAMPA WISZĄCA ZŁOTA/GOLD;2011006962429;45;-
003064-011263;P0488-01F-U8AC ROCK LAMPA WISZĄCA;2011006931050;0;150 week 50/2021| -
003064-010547;P181603B LIVAR LAMPA WISZĄCA;2011006700151;0;-
003064-011324;MD1921-3B-CLEAR BASTONI LAMPA WISZĄCA CHROME;2011006930534;0;50 week 52/2021 | -
003064-011293;W0488-01E-F4AC ROCK KINKIET CHROME;2011006962344;75;50 week 50/2021| -
003064-011269;W0389-01A-F7AC GEM KINKIET;2011006931210;0;200 January 2022 | -
003064-011260;C0491-06B-F7DY URCHIN LAMPA SUFITOWA;2011006930923;58;99 week 52/2021 | -
003064-011284;P0488-03A-B5FZ ROCK LAMPA WISZĄCA CHROME;2011006962160;17;-
003064-011290;P0509-05D-B5AC FROZE LAMPA WISZĄCA CLEAR;2011006962252;33;-
003064-011257;C0389-03F-F7AC GEM LAMPA SUFITOWA;2011006930893;9;50 in production | 50 in production | -
003064-011301;P0488-03D-B5HF ROCK LAMPA WISZĄCA ZŁOTA/GOLD;2011006962443;8;50 week 52/2021 | -
003064-011280;W0506-02A-B5AC QUASAR KINKIET CHROME;2011006933061;126;46 week 48/2021 | 54 week 50/2021| -
003064-011278;P0506-06A-F4AC QUASAR LAMPA WISZĄCA CHROME;2011006933047;60;-
003064-011443;MD1998A-3BL CONTE LAMPA WISZĄCA CZARNA-BIAŁA/BLACK-WHITE;2011006964188;35;50 in production | -
003064-011300;P0488-03D-B5FZ ROCK LAMPA WISZĄCA CHROME;2011006962436;0;50 week 50/2021| -
003064-011288;P0509-03D-B5AC FROZE LAMPA WISZĄCA CLEAR;2011006962207;19;-
003064-011455;P0454-01D-F7AC RIANO;2011007028773;50;25 week 48/2021 | -
003064-011445;MD1998B-4BL CONTE LAMPA WISZĄCA CZARNA-BIAŁA/BLACK-WHITE;2011006964232;21;-
003064-009046;RLX92175-5 ELLI LAMPA SUFITOWA;2011006345055;120;100 week 46/2021 | 100 in production | -
003064-011282;P0488-01A-F4FZ ROCK LAMPA WISZĄCA CHROME;2011006962016;33;-
003064-011321;MD1921-1-CLEAR BASTONI LAMPA WISZĄCA CHROME;2011006930503;0;152 week 52/2021 | -
003064-011256;C0389-03F-B5AC GEM LAMPA SUFITOWA;2011006930886;102;-
003064-009044;RLD92174-8B VERONA LAMPA WISZĄCA;2011006345031;309;220 week 46/2021 | -
003064-010892;RLD93015-1A GLOSS LAMPA WISZĄCA;2011006779973;26;50 week 46/2021 | -
003064-011417;ARGU10-031 CHIPO DL SPOT BIAŁY/WHITE;2011006935898;892;1000 week 52/2021 |
003064-010546;P181603A LIVAR LAMPA WISZĄCA;2011006700144;0;-
003064-011281;P0491-09F-F4AN URCHIN LAMPA WISZĄCA CHROME;2011006961811;113;20 week 48/2021 | 51 week 48/2021 | -
003064-011267;W0454-02D-STAC RIANO KINKIET;2011006931159;49;-
003064-011440;MD1998-1GL CONTE LAMPA WISZĄCA ZŁOTA-CZARNA-BIAŁA/GOLDEN-BLACK-WHITE;2011006964157;211;-
003064-011322;MB1921-1-CLEAR BASTONI KINKIET CHROME;2011006930510;48;-
003064-011454;P0454-01D-F7AA RIANO;2011007028735;67;-
003064-010893;RLD93054-3 GLOSS LAMPA WISZĄCA;2011006779980;34;50 week 46/2021 | -
003064-009041;RLX92174-8A VERONA LAMPA SUFITOWA;2011006345000;181;220 week 46/2021 | 100 in production | 100 in production | -
003064-011413;ACGU10-158 RONDIP SL SPOT BIAŁY/WHITE;2011006935805;0;500 week 52/2021 |
003064-010538;RLX96437-1M CARPI LAMPA SUFITOWA;2011006699363;139;-
003064-011295;P0389-03D-P7AC GEM LAMPA WISZĄCA CZARNY MAT/MATT BLACK;2011006962375;80;-
003064-011275;P0506-05A-F4E3 QUASAR LAMPA WISZĄCA ZŁOTA/GOLD;2011006932958;119;-
003064-011285;P0488-03A-B5HF ROCK LAMPA WISZĄCA ZŁOTA/GOLD;2011006962177;22;21 week 48/2021 | 29 week 52/2021 | -
003064-011292;P0488-07T-SEAC ROCK LAMPA WISZĄCA CZARNY MAT-ZŁOTY MAT/MATT BLACK-MATT GOLD;2011006962337;3;50 week 51/2021 -
003064-011283;P0488-01A-F4HF ROCK LAMPA WISZĄCA ZŁOTA/GOLD;2011006962153;0;33 week 50/2021 |
003064-009053;RLL94898-2 TWINS LAMPA PODŁOGOWA;2011006345154;455;500 week 46/2021 | -
003064-011258;C0389-05F-B5AC GEM LAMPA SUFITOWA;2011006930909;54;22 in production | -
003064-009042;RLX92174-8B VERONA LAMPA SUFITOWA;2011006345017;200;165 week 46/2021 | 55 week 46/2021 | 100 in production | -
003064-011441;MD1998-1BL CONTE LAMPA WISZĄCA CZARNA-BIAŁA/BLACK-WHITE;2011006964164;156;-
003064-011325;MD1918-1S-CHROME LAZARO LAMPA WISZĄCA CZARNA/BLACK;2011006930541;1;-
003064-011298;P0488-01F-F4FZ ROCK LAMPA WISZĄCA CHROME;2011006962412;160;50 week 48/2021 | 50 week 50/2021| -
003064-011272;C0506-05A-B5AC QUASAR LAMPA SUFITOWA CHROME;2011006932866;68;-
003064-011420;ARGU10-034 CHIPA DL SPOT CZARNY/BLACK;2011006935935;803;-
003064-010539;RLX96437-1L CARPI LAMPA SUFITOWA;2011006699387;133;-
003064-011414;ACGU10-159 RONDIP SL SPOT CZARNY/BLACK;2011006935812;637;-
003064-010548;W188101 AVO LAMPA SUFITOWA;2011006700168;0;-
003064-011416;ACGU10-161 QUARDIP SL SPOT CZARNY/BLACK;2011006935836;2126;-
003064-011271;C0506-05A-B5E3 QUASAR LAMPA SUFITOWA ZŁOTA/GOLD;2011006932781;15;-
003064-011296;P0389-05E-P7AC GEM LAMPA WISZĄCA CZARNY MAT/MATT BLACK;2011006962399;37;-
003064-010340;TS-5805-BKBB ZODIAC LAMPA PODŁOGOWA CZARNA;2011006690872;0;100 week 52/2021 | 100 in production | -
003064-011291;P0488-03K-SEAC ROCK LAMPA WISZĄCA CZARNY MAT-ZŁOTY MAT/MATT BLACK-MATT GOLD;2011006962276;0;50 week 52/2021 | 50 December 2021 | -
003064-011274;C0506-06A-B5AC QUASAR LAMPA SUFITOWA CHROME;2011006932934;68;-
003064-009043;RLD92174-8A VERONA LAMPA WISZĄCA;2011006345024;232;220 week 46/2021 | 100 in production | -
003064-011270;W0389-01A-B5AC GEM KINKIET;2011006931227;0;100 January 2022 | -
003064-011297;C0389-01A-P7AC GEM LAMPA SUFITOWA CZARNY MAT/MATT BLACK;2011006962405;0;200 week 52/2021 | -
003064-011279;W0506-02A-B5E3 QUASAR KINKIET ZŁOTY/GOLD;2011006933054;29;56 week 48/2021 | 44 week 48/2021 | 90 week 52/2021 | -
003064-011326;MD1918-3S-CHROME LAZARO LAMPA WISZĄCA CZARNA/BLACK;2011006930558;33;-
003064-011289;P0509-04C-B5AC FROZE LAMPA WISZĄCA CLEAR;2011006962214;54;-
003064-011442;MD1998A-3GL CONTE LAMPA WISZĄCA ZŁOTA-CZARNA-BIAŁA/GOLDEN-BLACK-WHITE;2011006964171;215;-
003064-011261;P0491-09C-F7DY URCHIN LAMPA WISZĄCA;2011006930992;82;62 week 48/2021 | 100 week 52/2021 | -
003064-011286;W0509-02A-B5AC FROZE KINKIET CLEAR;2011006962184;0;-
003064-010341;TS-010121T-BB SOHO GOLD LAMPA PODŁOGOWA;2011006690919;0;200 week 52/2021 | 195 in production | -
003064-010545;P181601 LIVAR LAMPA WISZĄCA;2011006700137;0;-
003064-011262;P0491-09E-F7DY URCHIN LAMPA WISZĄCA;2011006931036;43;58 week 48/2021 | 74 week 52/2021 | -
003064-011418;ARGU10-032 CHIPO DL SPOT CZARNY/BLACK;2011006935904;580;-
003064-011287;P0509-01D-F4AC FROZE LAMPA WISZĄCA CLEAR;2011006962191;0;-
003064-011444;MD1998B-4GL CONTE LAMPA WISZĄCA ZŁOTA-CZARNA-BIAŁA/GOLDEN-BLACK-WHITE;2011006964225;15;50 in production | -
003064-011259;C0389-05F-F7AC GEM LAMPA SUFITOWA;2011006930916;41;30 in production | -
003064-011415;ACGU10-160 QUARDIP SL SPOT BIAŁY/WHITE;2011006935829;2625;-
003064-011264;P0488-01M-SEAC ROCK LAMPA WISZĄCA;2011006931074;0;150 December 2021 | -
003064-010898;RLD96419-24 TRIM LAMPA WISZĄCA CZARNA/BLACK;2011006780054;0;-
003064-011276;P0506-05A-F4AC QUASAR LAMPA WISZĄCA CHROME;2011006932965;155;-
003064-011419;ARGU10-033 CHIPA DL SPOT BIAŁY/WHITE;2011006935928;0;1000 week 52/2021 |
003064-011277;P0506-06A-F4E3 QUASAR LAMPA WISZĄCA ZŁOTA/GOLD;2011006933009;34;-
003064-011265;W0488-01A-U8AC ROCK KINKIET;2011006931098;172;50 week 52/2021 | 100 week 50/2021| -
003064-010899;RLX96452-1A SLEEK LAMPA SUFITOWA;2011006869391;0;-
003064-010896;RLD96452-1A SLEEK LAMPA WISZĄCA;2011006780023;0;-
003064-010894;RLD93411-1 INDUSTRIAL LAMPA WISZĄCA;2011006779997;0;-
003064-010895;RLD931041-1 COOP LAMPA WISZĄCA;2011006780009;0;-
003064-011588;Lampa sufitrowa SENSI 19157L;2011007081594;257;-
003064-011587;Lampa sufitowa CAPRI 19027-M;2011007081563;217;75 + 51 + -
003064-011591;Lampa sufitowa PARDO 18365L;2011007081600;214;100 + 46 + -
003064-011589;Lampa sufitowa SENSI 19157M;2011007081587;275;-
003064-011590;Lampa sufitowa PARDO 18366;2011007081617;291;50 + -
003064-011586;Lampa sufitowa CAPRI 19027-L;2011007081570;332;50 + -
003064-011453;Q1908 LAMPA BIURKOWA BIAŁA/WHITE;2011006998688;0;600 in production | -
003064-011447;H1746 LAMPA BIURKOWA BIAŁA/WHITE;2011006998572;0;600 in production | -
003064-014360;U8 LAMPA BIURKOWA CZARNA/BLACK;2011007077979;61;-
003064-011449;H1816A LAMPA BIURKOWA CZARNA/BLACK;2011006998602;0;-
003064-014359;U11C LAMPA BIURKOWA CZARNA/BLACK;2011007077948;160;-
003064-011446;H1707 LAMPA BIURKOWA BIAŁA/WHITE;2011006998558;0;-
003064-011448;1112 LAMPA BIURKOWA CHROME;2011006998596;0;600 in production | -
003064-011452;H1927F LAMPA PODŁOGOWA CZARNA/BLACK;2011006998640;0;-
003064-011451;H1833 LAMPA BIURKOWA BIAŁA/WHITE;2011006998633;0;192 + 192 in production | -
003064-011450;H1832 LAMPA BIURKOWA BIAŁA/WHITE;2011006998626;0;-
003064-014361;Q10A LAMPA BIURKOWA BIAŁA/WHITE;2011007077993;0;-
003064-014358;M3A LAMPA BIURKOWA ZŁOTA/GOLD;2011007077931;200;-
003064-016651;19151 CASSIA LAMPA WISZĄCA CHROME;2011007081662;0;-
003064-016654;18144 CASTI LAMPA SUFITOWA CHROME;2011007081693;301;-
003064-016650;19031-M GRESSA LAMPA SUFITOWA CHROME;2011007081655;201;-
003064-016653;18143 CASTI LAMPA SUFITOWA CHROME;2011007081686;303;-
003064-016647;19156L SITANO LAMPA SUFITOWA CHROME;2011007081624;317;-
003064-016655;18096-L MONT LAMPA WISZĄCA CHROME;2011007081709;85;-
003064-016649;19154L TERRE LAMPA SUFITOWA CHROME;2011007081648;264;-
003064-016648;19154M TERRE LAMPA SUFITOWA CHROME;2011007081631;222;-
003064-016652;17013L GRIDO LAMPA SUFITOWA BIAŁA/WHITE;2011007081679;5;-
002177-014401;Lampa stołowa SAMASUN GFRAFIT 5503WH;5903938027277;3;-
002177-014412;Lampa stołowa MERSIN TRANSPARENT 5514BKGO;5903938027260;47;-
002177-014403;Lampa stołowa SAMASUN GFRAFIT 5505BKGO;5903938027291;5;-
002177-014402;Lampa stołowa SAMASUN GFRAFIT 5504BK;5903938027284;11;-
002177-014427;Lampa stołowa BATUMI TRANSPARENT 5529BKGO;5903938027208;14;-
002177-014419;Lampa stołowa ADANA GRAFIT 5521WH;5903938027000;10;-
002177-014417;Lampa stołowa ADANA TRANSPARENT 5519BK;5903938027079;33;-
002177-014429;Lampa stołowa BATUMI GRAFIT 5531BK;5903938027161;21;-
002177-014420;Lampa stołowa ADANA GRAFIT 5522BK;5903938027017;4;-
002177-014411;Lampa stołowa MERSIN TRANSPARENT 5513BK;5903938027253;19;-
002177-014398;Lampa stołowa SAMASUN TRANSPARENT 5500WH;5903938027307;5;-
002177-014430;Lampa stołowa BATUMI GRAFIT 5532BKGO;5903938027178;16;-
002177-014423;Lampa stołowa ADANA KREZLE 5525BK;5903938027048;16;-
002177-014410;Lampa stołowa MERSIN TRANSPARENT 5512WH;5903938027246;16;-
002177-014405;Lampa stołowa AMARSA TRANSPARENT 5507BK;5903938027130;24;-
002177-014400;Lampa stołowa SAMASUN TRANSPARENT 5502BKGO;5903938027321;21;-
002177-014404;Lampa stołowa AMARSA TRANSPARENT 5506WH;5903938027123;16;-
002177-014407;Lampa stołowa AMARSA GRAFIT 5509WH;5903938027093;3;-
002177-014413;Lampa stołowa MERSIN GRAFIT 5515WH;5903938027215;3;-
002177-014408;Lampa stołowa AMARSA GRAFIT 5510BK;5903938027109;2;-
002177-014418;Lampa stołowa ADANA TRANSPARENT 5520BKGO;5903938027086;10;-
002177-014406;Lampa stołowa AMARSA TRANSPARENT 5508BKGO;5903938027147;31;-
002177-014399;Lampa stołowa SAMASUN TRANSPARENT 5501BK;5903938027314;6;-
002177-014426;Lampa stołowa BATUMI TRANSPARENT 5528BK;5903938027192;18;-
002177-014409;Lampa stołowa AMARSA GRAFIT 5511BKGO;5903938027116;0;-
002177-014415;Lampa stołowa MERSIN GRAFIT 5517BKGO;5903938027239;0;-
002177-014425;Lampa stołowa BATUMI TRANSPARENT 5527WH;5903938027185;11;-
002177-014424;Lampa stołowa ADANA KREZLE 5526BKGO;5903938027055;0;-
002177-014416;Lampa stołowa ADANA TRANSPARENT 5518WH;5903938027062;21;-
002177-014422;Lampa stołowa ADANA KREZLE 5524WH;5903938027031;11;-
002177-014414;Lampa stołowa MERSIN GRAFIT 5516BK;5903938027222;0;-
002177-014428;Lampa stołowa BATUMI GRAFIT 5530WH;5903938027154;19;-
002177-014421;Lampa stołowa ADANA GRAFIT 5523BKGO;5903938027024;0;-
002177-016765;Mosiężna puszka rozgałęźna - 2 wyjścia równoległe;5903938027710;0;-
003064-016877;ZUMA.F16026 LINO LAMPA PODŁOGOWA;2017001932733;501;-
004046-016990;Łańcuch LED 4051;2017001933235;169;-
004046-016993;Łańcuch LED 4059;2017001933259;58;-
004046-016999;Łańcuch LED 4063;2017001933761;546;-
004046-016989;Łańcuch LED 4050;2017001933228;349;-
004046-016992;Łańcuch LED 4058;2017001933242;106;-
004046-016995;Łańcuch LED 4061;2017001933273;312;-
004046-016991;Łańcuch LED 4052;5901780540524;357;-
004046-016994;Łańcuch LED 4060;2017001933266;79;-
004046-016996 ;Łańcuch LED 4062;2017001933280;184;-
003064-016822;P0528-01F-V6AC SERGIO LAMPA WISZĄCA ZŁOTA/GOLD;2011007255315;0;98 week 52/2021 | 200 week 50/2021 |
003064-016827;W0528-02B-B5AC SERGIO KINKIET CHROME;2011007255407;31;100 December 2021 | -
003064-016786;P0528-08A-F4AC SERGIO LAMPA WISZĄCA CHROME;2011007192115;103;50 week 48/2021 | 100 week 52/2021 | 100 December 2021 | -
002177-016764;Mosiężna puszka rozgałęźna - 4 wyjścia równoległe;5903938027703;0;-
003064-016847;GU13013C-4B VILA SPOT CZARNY&ZŁOTY/BLACK&GOLD;2011007254905;0;-
002177-016759;PAROS AN2Z;5903938027659;0;-
003064-016821;P0528-01F-F4AC SERGIO LAMPA WISZĄCA CHROME;2011007255308;0;50 week 48/2021 | 47 week 52/2021 | 150 week 50/2021 |
003064-016839;CL20007-8 MEDA LAMPA SUFITOWA CHROM&BIAŁY/CHROME&WHITE;2011007254790;65;-
002177-016767;PERAMA A2810CZ;5903938027734;0;-
002177-016758;PAROS AN1Z;5903938027642;0;-
002177-016770;RAFINA G7 MINT 840 HF;5903938027758;0;-
002177-016735;ALIVERI A14Z;5903938027413;0;-
002177-016760;PAROS AN3/4Z;5903938027666;0;-
002177-016752;KAVALA A72Z;5903938027581;0;-
002177-016740;ALIVERI A67SZ;5903938027468;0;-
003064-016840;G917003A-2W SERPA KINKIET CZARNY/BLACK;2011007254820;4;-
002177-016771;RAFINA G7 840;5903938027765;0;-
003064-016833;CL12029-2CL ELVAS LAMPA SUFITOWA BIAŁA/WHITE;2011007254707;32;-
003064-016829;CL19020-1P-BL PORTO LAMPA WISZĄCA CZARNA/BLACK;2011007253793;0;-
003064-016824;P0528-06H-V6AC SERGIO LAMPA WISZĄCA ZŁOTA/GOLD;2011007255339;0;150 week 50/2021 |
002177-016750;KAVALA A53Z;5903938027567;0;-
002177-016737;ALIVERI A20Z;5903938027437;0;-
003842-014476;Lampa sufitowa DL-C515TX || DALEN;2017001932238;0;-
002177-016757;VOLOS A777KSZ;5903938027635;0;-
003064-016845;GU13013C-2B VILA SPOT CZARNY&ZŁOTY/BLACK&GOLD;2011007254882;20;-
003064-016787;P0528-08A-V6AC SERGIO LAMPA WISZĄCA ZŁOTA/GOLD;2011007192122;33;150 week 52/2021 | 150 December 2021 | -
003064-016783;W0528-01A-V6AC SERGIO KINKIET ZŁOTY/GOLD;2011007192085;0;198 week 52/2021 | 100 in production | -
002177-016761;PAROS AN3/3Z;5903938027673;0;-
003064-016855;DY106-D700 LOTTE LAMPA SUFITOWA BIAŁA-CHROM/WHITE-CHROME;2011007192283;153;25 + -
002177-016768;PERAMA A1380;5903938027741;0;-
003064-016853;DY136-D480 MILA LAMPA SUFITOWA BIAŁA/WHITE;2011007192269;252;40 + -
002177-016763;PAROS AN3/1Z;5903938027697;0;-
002177-016746;THIRA A46Z;5903938027529;0;-
003064-016849;P19106-5 GRANDE LAMPA WISZĄCA CZARNA/BLACK;2011007254929;34;-
003064-016848;P18358A-1F COMBA LAMPA PODŁOGOWA CZARNA/BLACK;2011007254912;0;-
003064-016831;CL19020-4-BL PORTO LAMPA SUFITOWA CZARNA/BLACK;2011007253816;0;-
002177-016742;Oprawa OVAL 25, E27, 75W, mosiądz, klosz przeźroczysty-szkło, IP64, siatka mosiężna;5903938027482;0;-
002177-016741;Oprawa OCZKO 67A, G9, 60W, mosiądz, klosz matowy-szkło, IP64;5903938027475;0;-
002177-016663;Lampa wisząca LA0722/1 - BK - CIRCLE Fi 1100mm dł. linek H2,5m;5903938027390;16;-
002177-016753;KAVALA A94Z;5903938027598;0;-
002177-016754;KAVALA A97Z;5903938027604;0;-
003064-016836;CL20007-1W MEDA KINKIET CHROM&BIAŁY/CHROME&WHITE;2011007254738;1;-
002177-016756;MILOS A56K;5903938027628;0;-
003064-016823;P0528-06H-F4AC SERGIO LAMPA WISZĄCA CHROME;2011007255322;0;100 week 50/2021 |
003064-016782;W0528-01A-B5AC SERGIO KINKIET CHROME;2011007192078;0;120 week 52/2021 | 80 week 50/2021| 200 December 2021 | -
002177-016744;THIRA A17Z;5903938027505;0;-
003064-016852;DY163-D510 HARM LAMPA SUFITOWA BIAŁA-CHROM/WHITE-CHROME;2011007192214;196;40 + -
002177-016745;THIRA A47Z;5903938027512;0;-
003064-016850;P19106-1W GRANDE KINKIET CZARNY/BLACK;2011007254936;52;-
002177-016762;PAROS AN3/2Z;5903938027680;0;-
003064-016835;CL20004-6 LIXA LAMPA SUFITOWA CHROME;2011007254721;1;-
003064-016832;CL19020-6-BL PORTO LAMPA SUFITOWA CZARNA/BLACK;2011007253823;79;-
003064-016841;G917003A-4CL SERPA LAMPA SUFITOWA CZARNA/BLACK;2011007254837;16;-
003064-016851;DY163-D400 HARM LAMPA SUFITOWA BIAŁA-CHROM/WHITE-CHROME;2011007192207;93;30 + -
002177-016738;ALIVERI A66Z;5903938027444;0;-
002177-016766;PERAMA A1160CZ;5903938027727;0;-
003064-016826;W0528-01F-V6AC SERGIO KINKIET ZŁOTY/GOLD;2011007255391;1;200 December 2021 | -
003842-016808;Lampa sufitowa DL-C515T || DALEN;2017001940899;0;-
002177-016748;KAVALA A15NZ;5903938027543;0;-
003064-016834;CL20004-3 LIXA LAMPA SUFITOWA CHROME;2011007254714;0;-
002177-016659;Lampa wisząca LA0717/1 - WH - CIRCLE Fi 1100mm dł. linek H2,5m;5903938027352;8;-
003064-016830;CL19020-1W-BL PORTO KINKIET CZARNY/BLACK;2011007253809;0;-
003064-016838;CL20007-5 MEDA LAMPA SUFITOWA CHROM&BIAŁY/CHROME&WHITE;2011007254783;0;-
002177-016661;Lampa wisząca LA0721/1 - BK - CIRCLE Fi 780mm dł. linek H2,5m;5903938027376;6;week 38/2021 |
003064-016825;W0528-01F-F4AC SERGIO KINKIET CHROME;2011007255384;26;150 December 2021 | -
002177-016739;ALIVERI A67Z;5903938027451;0;-
003064-016842;G917003A-6CL SERPA LAMPA SUFITOWA CZARNA/BLACK;2011007254844;27;-
002177-016736;ALIVERI A14SZ;5903938027420;0;-
003842-014477;Lampa sufitowa DL-C415TX|| DALEN;2017001931736;0;-
003064-016846;GU13013C-3R VILA SPOT CZARNY&ZŁOTY/BLACK&GOLD;2011007254899;0;-
003064-016844;GU13013C-1R  VILA SPOT CZARNY&ZŁOTY/BLACK&GOLD;2011007254875;0;-
002177-016747;THIRA A57Z;5903938027536;0;-
002177-016749;KAVALA A43Z;5903938027550;0;-
003064-016854;DY106-D520 LOTTE LAMPA SUFITOWA BIAŁA-CHROM/WHITE-CHROME;2011007192276;55;40 + -
003064-016837;CL20007-3 MEDA LAMPA SUFITOWA CHROM&BIAŁY/CHROME&WHITE;2011007254776;3;-
003064-016785;P0528-03A-V6AC SERGIO LAMPA WISZĄCA ZŁOTA/GOLD;2011007192108;30;35 week 48/2021 | 64 week 52/2021 | 36 week 50/2021| 100 December 2021 | -
003064-016819;C0528-05H-F4AC SERGIO LAMPA SUFITOWA CHROME;2011007255285;0;50 week 52/2021 | 100 week 50/2021 |
