kod towaru;nazwa;ean;stan;dostepnosc
003064-016856;DY111-D800 FRAN LAMPA SUFITOWA BIAŁO-SREBRNO-SZARA/WHITE-SILVER-GRAY;2011007192290;130;-
003064-016820;C0528-05H-V6AC SERGIO LAMPA SUFITOWA ZŁOTA/GOLD;2011007255292;0;50 week 52/2021 | 150 December 2021 | -
003064-016828;W0528-02B-V6AC SERGIO KINKIET ZŁOTY/GOLD;2011007255414;0;400 December 2021 | -
002177-016751;KAVALA A63Z;5903938027574;0;-
002177-016657;Lampa wisząca LA0716/1 - WH - CIRCLE Fi 780mm dł. linek H2,5m;5903938027338;16;-
003064-016843;G917003A-5TUP SERPA LAMPA SUFITOWA CZARNA/BLACK;2011007254851;0;-
003064-016784;P0528-03A-F4AC SERGIO LAMPA WISZĄCA CHROME;2011007192092;6;100 week 52/2021 | 100 December 2021 | -
002177-016743;THIRA A44Z;5903938027499;0;-
003064-017061;H-20038-BK RONDOC SPOT CZARNY/BLACK;2011007155943;256;-
003064-017071;H-20068-WH CHUCK DL2 SQUARE SPOT BIAŁY/WHITE;2011007156063;0;-
003064-017068;H-92700 CHUCK DL ROUND SPOT CZARNY/BLACK;2011007156032;308;-
003064-017064;H-89200-BK QUADRO SPOT CZARNY/BLACK;2011007155974;305;-
003064-017074;H-20016-BK TORI SL3 SPOT CZARNY/BLACK;2011007156094;2;-
003064-017073;H-20016-WH TORI SL3 SPOT BIAŁY/WHITE;2011007156087;1496;-
003064-017069;H-92704 CHUCK DL SQUARE SPOT CZARNY/BLACK;2011007156049;61;-
003064-017067;H-92699 CHUCK DL ROUND SPOT BIAŁY/WHITE;2011007156018;0;-
003064-017072;H-20068-BK CHUCK DL2 SQUARE SPOT CZARNY/BLACK;2011007156070;0;-
003064-017063;H-89201 RONDOO SPOT CZARNY/BLACK;2011007155967;1372;-
003064-017070;H-92703 CHUCK DL SQUARE SPOT BIAŁY/WHITE;2011007156056;187;-
003064-017062;H-45519 RONDOO SPOT BIAŁY/WHITE;2011007155950;1910;-
003064-017060;H-20038-WH RONDOC SPOT BIAŁY/WHITE;2011007155912;2375;-
003064-017065;H-89200-WH QUADRO SPOT BIAŁY/WHITE;2011007155981;717;-
003064-017066;H-50475-BK SQUARE SPOT CZARNY/BLACK;2011007155998;597;-
003842-000001;Pilot Dalen;2017001935161;0;-
003064-012858;P0461-01A-P7P7 LOYA LAMPA WISZĄCA;2011007108833;0;100 January 2022 | -
003064-019212;W0461-02E-P7P7 ONE KINKIET CZARNY/BLACK;2011007307229;0;-
003064-019211;W0461-02B-P7P7 LOYA KINKIET CZARNY/BLACK;2011007307144;0;50 January 2022 | -
003064-019910;P0461-01E-P7P7 ONE LAMPA WISZĄCA CZARNA/BLACK;2011007307236;0;400 January 2022 | -
003064-019922;P0461-09L-P7P7 (B5P7) ONE LAMPA WISZĄCA CZARNA/BLACK;2011007307212;0;-
003064-020079;ARGU10-039 RONDOO DL ROUND PLAFON CZARNY/BLACK;2011007307533;373;-
003064-011302;P0491-09D-F7AC URCHIN LAMPA WISZĄCA;2011007011638;0;80 December 2021 | -
003064-020078;ARGU10-038 RONDOO DL ROUND PLAFON BIAŁY/WHITE;2011007307526;202;-
003064-020083;ARGU10-043 ONEON DL ROUND 50-2 PLAFON CZARNY/BLACK;2011007307724;327;-
003064-020094;W0461-01A-K4K4 LOYA KINKIET ZŁOTY/GOLD;2011007307120;0;-
003064-020095;W0461-01A-L8L8 LOYA KINKIET CZARNY/BLACK;2011007307137;72;-
003064-020085;ARGU10-045 ONEON DL ROUND 111-1 PLAFON CZARNY/BLACK;2011007307748;426;-
003064-020081;ARGU10-041 RONDOO DL SQUARE PLAFON CZARNY/BLACK;2011007307557;339;-
003064-020076;W0461-01A-P7P7 (STP7) LOYA KINKIET CZARNY/BLACK;2011007307151;61;-
003064-020082;ARGU10-042 ONEON DL ROUND 50-1 PLAFON BIAŁY/WHITE;2011007307717;298;-
003064-020080;ARGU10-040 RONDOO DL SQUARE PLAFON BIAŁY/WHITE;2011007307540;357;-
003064-019084;RLX92175-5R ELLI LAMPA SUFITOWA CHROME;2011007250822;17;100 in production | -
003064-020084;ARGU10-044 ONEON DL ROUND 111-1 PLAFON BIAŁY/WHITE;2011007307731;435;-
003064-020077;P0461-09C-P7P7 (B5P7) LOYA LAMPA WISZĄCA CZARNA/BLACK;2011007307168;39;-
003064-019921;W0461-02B-K4K4 LOYA KINKIET ZŁOTY/GOLD;2011007307113;0;100 January 2022 | -
003064-019160;Lampa podłogowa INGA H06-GD-BL;5903938027789;28;-
003064-019159;Lampa podłogowa INGA H06-GD-GR;5903938027772;37;-
003064-019161;Lampa podłogowa INGA H06-GD-BK;5903938027796;10;-
003064-020124;PL200910-600-SL CARLO LAMPA WISZĄCA SREBRNA/SILVER;2011007314241;21;100 in production | -
003064-020121;PL200910-600-GD CARLO LAMPA WISZĄCA ZŁOTA/GOLD;2011007314180;0;100 in production | -
003064-020122;PL200910-400-SL CARLO LAMPA WISZĄCA SREBRNA/SILVER;2011007314197;104;-
003064-020123;PL200910-500-SL CARLO LAMPA WISZĄCA SREBRNA/SILVER;2011007314234;120;-
003064-020120;PL200910-500-GD CARLO LAMPA WISZĄCA ZŁOTA/GOLD;2011007314173;53;-
003064-020119;PL200910-400-GD CARLO LAMPA WISZĄCA ZŁOTA/GOLD;2011007314166;6;100 in production | -
003064-019085;RLX92175-6R ELLI LAMPA SUFITOWA CHROME;2011007250839;16;100 in production | -
003064-018119;H-50475-WH SQUARE SPOT BIAŁY/WHITE;2017001939329;860;-
003064-021035;L.RLL94898-2 TWINS LAMPA PODŁOGOWA ramiona z oprawkami i przewodem;;463;500 week 46/2021 | -
003064-020114;19058P FORE LAMPA WISZĄCA SREBRNY/SILVER;2011007344811;73;-
003064-020115;19051M(CH) PARO LAMPA SUFITOWA CHROME;2011007344859;88;-
003064-020116;19051M(GD) PARO LAMPA SUFITOWA ZŁOTA/GOLD;2011007344866;117;-
003064-020117;19051CH-P PARO LAMPA WISZĄCA CHROME;2011007344873;87;-
003064-020118;19051GD-P PARO LAMPA WISZĄCA ZŁOTA/GOLD;2011007344880;104;-
003064-020086;C0525-05A-P7D7 NAICA LAMPA SUFITOWA ZŁOTA&CZARNA/GOLD&BLACK;2011007388754;0;-
003064-020087;P0525-04A-P7D7 NAICA LAMPA WISZĄCA ZŁOTA&CZARNA/GOLD&BLACK;2011007388778;0;-
003064-020096;P0531-01A-F4AC ORE LAMPA WISZĄCA CHROME;2011007388655;0;76 week 48/2021 | -
003064-020097;P0531-04B-B5AC ORE LAMPA WISZĄCA CHROME;2011007388662;33;-
003064-020098;P0531-06C-B5AC ORE LAMPA WISZĄCA CHROME;2011007388679;41;-
003064-020099;C0523-04A-U8AC PALACE LAMPA SUFITOWA ZŁOTA/GOLD;2011007388716;66;-
003064-020100;P0523-08A-U8AC PALACE LAMPA WISZĄCA ZŁOTA/GOLD;2011007388723;57;47 week 48/2021 | -
003064-020101;W0523-01A-U8AC PALACE KINKIET ZŁOTY/GOLD;2011007388730;112;94 week 48/2021 | -
003064-020102;C0525-05A-V6B5 NAICA LAMPA SUFITOWA ZŁOTA/GOLD;2011007388747;7;-
003064-020103;P0525-04A-F4V6 NAICA LAMPA WISZĄCA ZŁOTA/GOLD;2011007388761;23;-
003064-020104;C0535-05B-F4AC GLADIUS LAMPA SUFITOWA CHROME;2011007388792;2;-
003064-020105;C0535-05B-F4J7 GLADIUS LAMPA SUFITOWA ZŁOTA/GOLD;2011007388808;0;-
003064-020106;P0535-05B-F4AC GLADIUS LAMPA WISZĄCA CHROME;2011007388815;0;-
003064-020107;P0535-05B-F4J7 GLADIUS LAMPA WISZĄCA ZŁOTA/GOLD;2011007388822;0;-
003064-020108;W0535-01B-B5AC GLADIUS KINKIET CHROME;2011007388839;19;-
003064-020109;W0535-01B-B5J7 GLADIUS KINKIET ZŁOTY/GOLD;2011007388846;0;-
003064-020110;C0539-06A-F4AC STAR LAMPA SUFITOWA CHROME;2011007388853;2;-
003064-020111;C0539-06A-F7DY STAR LAMPA SUFITOWA ZŁOTA/GOLD;2011007388860;12;-
003064-020112;P0539-06A-F4AC STAR LAMPA WISZĄCA CHROME;2011007388884;0;-
003064-020113;P0539-06A-F7DY STAR LAMPA WISZĄCA ZŁOTA/GOLD;2011007388891;0;-
003064-021942;P0461-11L-P7SD ONE LAMPA WISZĄCA CZARNY MAT+ZŁOTA/MATT BLACK+FRENCH GOLD;2011007473948;0;100 January 2022 | -
003064-021952;20034-WH TUBO WL KINKIET BIAŁY/WHITE;2011007480663;431;-
003064-021957;ACGU10-183 MASTER 111-2-SL SPOT BIAŁY/WHITE;2011007480731;327;-
003064-021935;C0461-09C-B5F4 LOYA LAMPA SUFITOWA CHROME;2011007473849;0;100 January 2022 | -
003064-021947;W0528-02M-B5AC SERGIO KINKIET CHROME;2011007474006;0;196 week 50/2021| -
003064-021956;ACGU10-181 MASTER 111 SL SPOT CZARNY/BLACK;2011007480724;314;-
003064-021934;W0461-03N-P7SD LOYA KINKIET CZARNO-ZŁOTY/BLACK-FRENCH GOLD;2011007473818;0;100 January 2022 | -
003064-021945;W0528-02N-V6AC SERGIO KINKIET ZŁOTY MAT/MATT GOLD;2011007473986;0;200 week 51/2021 -
003064-021939;C0461-11C-P7SD LOYA LAMPA SUFITOWA CZARNY MAT+ZŁOTA/MATT BLACK+FRENCH GOLD;2011007473917;0;100 January 2022 | -
003064-021940;C0461-11C-S8S8 LOYA LAMPA SUFITOWA BIAŁY MAT/MATT WHITE;2011007473924;0;100 January 2022 | -
003064-021954;ARGU10-066 MOONING SL SPOT CZARNY/BLACK;2011007480885;432;-
003064-021941;P0461-09L-P7SD ONE LAMPA WISZĄCA CZARNY MAT+ZŁOTA/MATT BLACK+FRENCH GOLD;2011007473931;0;100 January 2022 | -
003064-021933;P0461-11A-P7SD LOYA LAMPA WISZĄCA CZARNY MAT+ZŁOTA/MATT BLACK+FRENCH GOLD;2011007473771;0;100 January 2022 | -
003064-021944;W0528-02N-B5AC SERGIO KINKIET CHROME;2011007473979;0;200 week 51/2021 -
003064-021946;W0528-02N-F7AC SERGIO KINKIET ZŁOTY/FRENCH GOLD;2011007473993;0;200 week 51/2021 -
003064-021949;W0528-02M-F7AC SERGIO KINKIET ZŁOTY/FRENCH GOLD;2011007474020;0;197 week 50/2021| -
003064-021937;C0461-09C-S8S8 LOYA LAMPA SUFITOWA BIAŁY MAT/MATT WHITE;2011007473894;0;100 January 2022 | -
003064-021950;ARGU10-054 CHUCK 111 SL ROUND SPOT BIAŁY/WHITE;2011007480687;437;-
003064-021958;ACGU10-184 MASTER 111-2-SL SPOT CZARNY/BLACK;2011007480748;327;-
003064-021953;ARGU10-052 MOONING SL SPOT BIAŁY/WHITE;2011007480878;422;-
003064-021943;W0461-03L-P7SD ONE KINKIET ZŁOTY/FRENCH GOLD;2011007473955;0;100 January 2022 | -
003064-021932;P0461-09C-P7SD LOYA LAMPA WISZĄCA CZARNY MAT+ZŁOTA/MATT BLACK+FRENCH GOLD;2011007472293;0;100 January 2022 | -
003064-021951;ARGU10-055 CHUCK 111 SL ROUND SPOT CZARNY/BLACK;2011007480694;349;-
003064-021936;C0461-09C-P7SD LOYA LAMPA SUFITOWA CZARNY MAT+ZŁOTA/MATT BLACK+FRENCH GOLD;2011007473887;0;100 January 2022 | -
003064-021955;ACGU10-180 MASTER 111 SL SPOT BIAŁY/WHITE;2011007480700;314;-
003064-021938;C0461-09C-P7P7 LOYA LAMPA SUFITOWA CZARNY MAT/MATT BLACK;2011007473900;0;100 January 2022 | -
003064-021948;W0528-02M-V6AC SERGIO KINKIET ZŁOTY MAT/MATT GOLD;2011007474013;0;198 week 50/2021| -
003064-021959;PL210503-800-BK CARLO LAMPA WISZĄCA CZARNY MAT/MATTE BLACK;;0;
003064-021962;PL210503-800-GD CARLO LAMPA WISZĄCA ZŁOTA/GOLD;;0;
003064-021964;PL210503-800+1200-GD CARLO LAMPA WISZĄCA ZŁOTA/GOLD;;0;
003064-021963;PL210503-1200-GD CARLO LAMPA WISZĄCA ZŁOTA/GOLD;;0;
003064-021961;PL210503-800+1200-BK CARLO LAMPA WISZĄCA CZARNY MAT/MATTE BLACK;;0;
003064-021960;PL210503-1200-BK CARLO LAMPA WISZĄCA CZARNY MAT/MATTE BLACK;;0;
003064-022214;C0531-01A-F4AC ORE LAMPA SUFITOWA;;0;50 January 2022 |
003064-022277;495 TESSA LAMPA PODŁOGOWA;;0;
003064-022276;5131 TESSA LAMPA PODŁOGOWA;;0;
003064-022270;3062 MANGRI LAMPA PODŁOGOWA;;0;
003064-022275;5130 TESSA LAMPA PODŁOGOWA;;0;
002898-022179;OPR.OŚWIET.AMPLI Z-6 CZARNY I ZŁOTY 6221Z-H02-06;5900108047752;20;
003064-022271;3067 KALAIYA LAMPA PODŁOGOWA;;0;
003064-022273;3112 NALLU LAMPA PODŁOGOWA;;0;
002898-022181;OPR.OŚWIET.AMPLI K-1 CZARNY I ZŁOTY 6223K-H02-06;5900108047776;20;
002898-022182;OPR.OŚWIET.ROCCO Z-3 ZŁOTY 6231Z-H06;5900108047790;18;
002898-022178;OPR.OŚWIET.AMPLI Z-8 CZARNY I ZŁOTY 6220Z-H02-06;2017001942787;18;
003064-022267;3060 MANGRI LAMPA PODŁOGOWA ;;0;
003064-022274;3130 NALLU LAMPA PODŁOGOWA;;0;
002898-022180;OPR.OŚWIET.AMPLI K-2 CZARNY I ZŁOTY 6222K-H02-06;5900108047769;20;
003064-022272;3092 KALAIYA LAMPA PODŁOGOWA;;0;
